<!ELEMENT bookshop (book+, link)>
<!ELEMENT book (title, author, genre, description, price)>
<!ELEMENT title (#PCDATA)>
<!ELEMENT author (#PCDATA)>
<!ELEMENT genre (#PCDATA)>
<!ELEMENT description (#PCDATA)>
<!ELEMENT price (#PCDATA)>
<!ELEMENT link (a)>
<!ELEMENT a (#PCDATA)>
<!ATTLIST a href CDATA #REQUIRED>